{
  "schema_version": "mulgae-composite-run-manifest.v2",
  "session_id": "s_019f596a-cf80-7c67-b265-f37053d51ccf",
  "run_id": "r_a762f42b-e969-74a1-a00c-ea406393240e",
  "run_type": "composite",
  "state": "completed",
  "sealed": true,
  "created_at": "2026-07-13T03:10:00Z",
  "completed_at": "2026-07-13T03:10:01Z",
  "target": {
    "manifest_path": "target/target-manifest.json",
    "content_sha256": "sha256:aaaaaaaaaaaaaaaaaaaaaaaaaaaaaaaaaaaaaaaaaaaaaaaaaaaaaaaaaaaaaaaa"
  },
  "immutable_lineage": {
    "parent_run_id": null,
    "source_run_id": null,
    "source_review_id": null,
    "source_finding_ref": null,
    "replay_mode": null,
    "lineage_edge_path": "store/lineage-edges/e_019f596a-d176-7321-b920-c2d312c82cc2.json",
    "lineage_edge_sha256": "sha256:aaaaaaaaaaaaaaaaaaaaaaaaaaaaaaaaaaaaaaaaaaaaaaaaaaaaaaaaaaaaaaaa"
  },
  "review_composition": {
    "fingerprint": "sha256:a762f42be96904a1e00cea406393240e136db165185d5512b3383e345344cbd1",
    "root_run_id": "r_019f596a-cfe4-7c9c-b82e-7149158243ba",
    "sources": [
      {
        "kind": "root",
        "role": "logic",
        "run_id": "r_019f596a-cfe4-7c9c-b82e-7149158243ba",
        "attempt_id": "a_019f596a-d048-79e7-b2b7-59822f012273",
        "role_report_sha256": "sha256:cccccccccccccccccccccccccccccccccccccccccccccccccccccccccccccccc",
        "source_kind": "failed_run_recovery",
        "recovery_manifest_sha256": "sha256:dddddddddddddddddddddddddddddddddddddddddddddddddddddddddddddddd"
      },
      {
        "kind": "recovery",
        "role": "security",
        "run_id": "r_019f596a-cfe6-7c9c-b82e-7149158243ba",
        "review_id": "019f596a-d175-7321-b920-c2d312c82cc2",
        "attempt_id": "a_019f596a-d049-79e7-b2b7-59822f012273",
        "role_report_sha256": "sha256:dddddddddddddddddddddddddddddddddddddddddddddddddddddddddddddddd",
        "source_kind": "published_review"
      }
    ],
    "root_recovery_manifest_sha256": "sha256:dddddddddddddddddddddddddddddddddddddddddddddddddddddddddddddddd",
    "root_source_kind": "failed_run_recovery"
  },
  "selected_roles": [
    "logic",
    "security"
  ],
  "required_roles": [
    "logic",
    "security"
  ],
  "content_verdict": "findings_present",
  "coverage_status": "complete",
  "structured_extraction_status": "structured",
  "publication_status": "committed",
  "ci_decision": "pass",
  "ci_reason_codes": [
    "policy_evaluated"
  ],
  "persisted_journal_state": "manifest_committed",
  "durable_observation_class": "P2_COMMITTED",
  "derived_publication_status": "committed",
  "publication_authority": "P2",
  "recovery_action": "reconstruct_completed_status",
  "recovery_journal": {
    "expected_staged": {
      "path": "s_019f596a-cf80-7c67-b265-f37053d51ccf/r_a762f42b-e969-74a1-a00c-ea406393240e/publication/staged/review_019f596a-d176-7321-b920-c2d312c82cc2.json.tmp",
      "sha256": "sha256:ffffffffffffffffffffffffffffffffffffffffffffffffffffffffffffffff"
    },
    "expected_final": {
      "path": "s_019f596a-cf80-7c67-b265-f37053d51ccf/r_a762f42b-e969-74a1-a00c-ea406393240e/review_019f596a-d176-7321-b920-c2d312c82cc2.json",
      "sha256": "sha256:ffffffffffffffffffffffffffffffffffffffffffffffffffffffffffffffff"
    },
    "validated_candidate_sha256": "sha256:eeeeeeeeeeeeeeeeeeeeeeeeeeeeeeeeeeeeeeeeeeeeeeeeeeeeeeeeeeeeeeee"
  },
  "composite_identity": {
    "manifest": {
      "path": "s_019f596a-cf80-7c67-b265-f37053d51ccf/r_a762f42b-e969-74a1-a00c-ea406393240e/manifest.json"
    },
    "lineage_edge": {
      "path": "store/lineage-edges/e_019f596a-d176-7321-b920-c2d312c82cc2.json",
      "sha256": "sha256:aaaaaaaaaaaaaaaaaaaaaaaaaaaaaaaaaaaaaaaaaaaaaaaaaaaaaaaaaaaaaaaa"
    },
    "epoch": {
      "path": "store/epochs/epoch_00000000000000000001.json"
    },
    "support_index": {
      "path": "s_019f596a-cf80-7c67-b265-f37053d51ccf/r_a762f42b-e969-74a1-a00c-ea406393240e/support/index.json",
      "sha256": "sha256:bbbbbbbbbbbbbbbbbbbbbbbbbbbbbbbbbbbbbbbbbbbbbbbbbbbbbbbbbbbbbbbb"
    }
  },
  "final_review": {
    "review_id": "019f596a-d176-7321-b920-c2d312c82cc2",
    "path": "s_019f596a-cf80-7c67-b265-f37053d51ccf/r_a762f42b-e969-74a1-a00c-ea406393240e/review_019f596a-d176-7321-b920-c2d312c82cc2.json",
    "sha256": "sha256:ffffffffffffffffffffffffffffffffffffffffffffffffffffffffffffffff"
  },
  "role_reports": [
    {
      "role": "logic",
      "path": "role-reports/logic.md",
      "sha256": "sha256:cccccccccccccccccccccccccccccccccccccccccccccccccccccccccccccccc",
      "byte_length": 42,
      "attempt_id": "a_019f596a-d048-79e7-b2b7-59822f012273",
      "source_run_id": "r_019f596a-cfe4-7c9c-b82e-7149158243ba"
    },
    {
      "role": "security",
      "path": "role-reports/security.md",
      "sha256": "sha256:dddddddddddddddddddddddddddddddddddddddddddddddddddddddddddddddd",
      "byte_length": 42,
      "attempt_id": "a_019f596a-d049-79e7-b2b7-59822f012273",
      "source_run_id": "r_019f596a-cfe6-7c9c-b82e-7149158243ba"
    }
  ],
  "exit_code": 0
}
